{
  "protocol": "improvement-proposal/1",
  "proposal_id": "proposal-si05-fixture-01",
  "pattern_ids": ["pattern-si05-fixture-01"],
  "question": "Should module_a.py and module_b.py set their completion markers?",
  "choice": "Set MARKER_A/MARKER_B to True once each module's guard is satisfied.",
  "alternatives": [
    "Leave the markers False and document the gap instead."
  ],
  "rationale": "Fixture-only proposal used by tests/test_self_improve_loop.py to exercise SI-05's open/round/remeasure/close loop end to end with no live model and no real browser.",
  "evidence": [
    "tests/fixtures/improvement/loop/proposal.json"
  ],
  "consequences": [
    "None beyond the two fixture modules; this proposal never targets real product code."
  ],
  "reversible": true,
  "status": "accepted",
  "demonstrated_failure": "Both fixture modules are observed with their completion marker left False across the fixture's seed journal.",
  "production_consumer": "tests/test_self_improve_loop.py, the controller-owned SI-05 verification gate.",
  "end_to_end_assertion": "Each module's own success-criterion assertion re-reads the file and checks its marker literal after a round claims the fix.",
  "target_surface": [
    {"path": "src/pkg_a/module_a.py", "kind": "code", "governing_decisions": []},
    {"path": "src/pkg_b/module_b.py", "kind": "code", "governing_decisions": []}
  ],
  "accuracy_risk": "none",
  "success_criteria": [
    {
      "file": "src/pkg_a/module_a.py",
      "subject": "marker-a-not-set",
      "required_paths": ["src/pkg_a/module_a.py"],
      "statement": "src/pkg_a/module_a.py sets MARKER_A = True.",
      "assertion": {
        "argv": ["python3", "-c", "import pathlib, sys; sys.exit(0 if 'MARKER_A = True' in pathlib.Path('src/pkg_a/module_a.py').read_text() else 1)"],
        "timeout_seconds": 30
      }
    },
    {
      "file": "src/pkg_b/module_b.py",
      "subject": "marker-b-not-set",
      "required_paths": ["src/pkg_b/module_b.py"],
      "statement": "src/pkg_b/module_b.py sets MARKER_B = True.",
      "assertion": {
        "argv": ["python3", "-c", "import pathlib, sys; sys.exit(0 if 'MARKER_B = True' in pathlib.Path('src/pkg_b/module_b.py').read_text() else 1)"],
        "timeout_seconds": 30
      }
    }
  ],
  "rollback": "Revert MARKER_A/MARKER_B to False; no other state is touched.",
  "ruling": {
    "disposition": "accept",
    "actor": "operator",
    "statement": "Accepted for SI-05 loop-driver fixture testing; bounded and reversible.",
    "ruled_at": "2026-08-21T00:00:00Z"
  }
}
